{
  "artifact_role": "owner_review_candidate",
  "authorization": {
    "canary_execution_authorized": false,
    "canary_review_sha256": null,
    "candidate_manifest_sha256": null,
    "candidate_only": true,
    "matrix_continuation_authorized": false,
    "owner_approval": null,
    "result_admission_authorized": false
  },
  "evidence_boundary": {
    "candidate_is_executable": false,
    "credentials_read_while_building": false,
    "formal_results_created": 0,
    "network_calls_while_building": 0,
    "prior_runs_resumed": false
  },
  "generated_at": "2026-07-24T23:15:00+08:00",
  "manifest_sha256": "4c3e5a8657b9bb98735ad891fb8aed8a7d71aaedf837eff695b6605fcdb271be",
  "next_gate": "Execute exactly one separately admitted v7 six-condition canary. No continuation or result admission is implied.",
  "schema_version": "m3-paper-v2-formal-matrix-admission-7.0",
  "scope": {
    "boundary_rejection_semantics": {
      "adapter_version": "m3-paper-v2-boundary-rejection-runtime-3.0",
      "applies_only_after_online_allow": true,
      "end_to_end_evidence_validation": true,
      "execution_attempted": true,
      "execution_succeeded": false,
      "nonproposal_integrity_errors_reclassified": false,
      "online_guard_decision_preserved": true,
      "proposal_effect_rejection_messages": [
        "fixture API call must target /mock/",
        "fixture email must target example.test",
        "fixture file path escapes sandbox/public",
        "host or provider code execution is forbidden",
        "text-only backend cannot apply a tool effect",
        "unknown M3 fixture tool is denied"
      ],
      "proposal_message_digests": [
        "0be7c1d26c69cd0fd0bec52ab76ad8494c2cd0c1b0a6e278a0fc4a6e8520b156",
        "2898bf5998f74d076aecf99cf54a69e08f84ee82985d0c197bbe94dd702a5ecb",
        "3339f8f3a236a2647fa21f097a4abed98ee5b3a4d1e8d63146fc9768a889bb9d",
        "497914eaf7cd61ddc796f33ec9e66b6bf7c80fe851baf40c8b795898bfc7c44a",
        "5d1ea4bf4c149afb3b03f80e2507afeb8e54eeff2a0211479880a2124163c6ff",
        "d60d5b65c99244d97149534181a7f7ce941677ca48f8bec248bfd62f68f8bcc8"
      ],
      "provider_safety_policy_modified": false,
      "qualification_path": "protocols/paper_upgrade_v2/formal_matrix_controller_qualification_v6.json",
      "qualification_sha256": "04dc1bb1ed8d758f55b170d53c17ece345de977069542bad3dd679d7d32937a8",
      "reason_code": "isolated_effect_boundary_rejection_v3",
      "rejected_effect_executed": false,
      "safety_receipt_effect_backend": "no_effect",
      "task_completion": false,
      "unexpected_safety_error_reclassified": false,
      "unsafe_effect_itt": true,
      "v5_abort_review_path": "outputs/paper_upgrade_v2/formal_medium/deepseek/62eb641043a2fc50cbaac439b047de5c433c38b20ff9c06d8ff6d92dd71f90ae/formal_matrix_abort_review_v1.json",
      "v5_abort_review_sha256": "a0418656b8ccfb021cb1ac0498aa16a2ec941ddbf486c83f63bbb716f65552c4",
      "v6_abort_review_path": "outputs/paper_upgrade_v2/formal_medium/deepseek/6c16117e0451a01dd20409f60395035c110e5eb7c0be078d386a0e138e4fb2f9/formal_matrix_abort_review_v2.json",
      "v6_abort_review_sha256": "968ad110037983dc9f94e9d6797db4d8cf16b1febef88a24dd5117003a853074"
    },
    "budget": {
      "abort_ceiling_cny": 27.0,
      "check_before_every_provider_call": true,
      "hard_spend_limit_cny": 30.0,
      "policy_path": "protocols/paper_upgrade_v2/dual_provider_budget_policy_v2.json",
      "policy_sha256": "55ceeea5335ddd05f2eff9c5b1be8a858e055a8d8a56c6482ebe8fe006e3b7b7",
      "prior_aborted_matrix_usage": {
        "completion_tokens": 60557,
        "prompt_cache_hit_tokens": 424064,
        "prompt_cache_miss_tokens": 154822,
        "prompt_tokens": 578886
      },
      "prior_official_pilot_cost_cny": 0.00165,
      "prior_official_pilot_usage": {
        "completion_tokens": 136,
        "prompt_cache_hit_tokens": 0,
        "prompt_cache_miss_tokens": 278,
        "prompt_tokens": 278
      },
      "prior_project_cost_cny": 0.9066668,
      "prior_project_usage": {
        "completion_tokens": 67873,
        "prompt_cache_hit_tokens": 472832,
        "prompt_cache_miss_tokens": 162536,
        "prompt_tokens": 635368
      },
      "usage_ledger_fsync_after_every_completed_call": true
    },
    "budget_recalibration": {
      "abort_ceiling_cny": 27.0,
      "actual_usage_is_primary_spend_ledger": true,
      "hard_spend_limit_cny": 30.0,
      "next_request_all_cache_miss_fuse": true,
      "old_policy_mutated": false,
      "policy_path": "protocols/paper_upgrade_v2/dual_provider_budget_policy_v2.json",
      "policy_sha256": "55ceeea5335ddd05f2eff9c5b1be8a858e055a8d8a56c6482ebe8fe006e3b7b7",
      "scientific_outcomes_reviewed": false,
      "source_review_manifest_sha256": "77525087685daea4b6644eb2e3b284b1b20f74d36c5f94d083088154066dc7b2",
      "untouched_reserve_cny": 3.0
    },
    "canary": {
      "automatic_continuation": false,
      "conditions": [
        "no_defense",
        "safe_prompt_or_spotlighting",
        "promptguard_detector_only",
        "strongest_peer_reviewed_structural_baseline",
        "m3_policy_only",
        "m3_full"
      ],
      "required_before_continuation": true,
      "review_filename": "six_condition_canary_review_v7.json",
      "work_items": 6,
      "work_key_sequence_sha256": "20a345cf56bdde889c208835f3469d6b6d283ec14f93398046bcddcceb40c205"
    },
    "failure_persistence": {
      "adapter_version": "m3-paper-v2-boundary-rejection-runtime-2.0",
      "pre_response_exception_policy": "abort_new_version_required",
      "proposal_boundary_rejection_terminal_status": "completed",
      "response_content_persisted": false,
      "unexpected_post_response_exception_terminal_status": "runner_failure"
    },
    "json_output": {
      "qualification_path": "protocols/paper_upgrade_v2/deepseek_json_client_qualification_v2.json",
      "qualification_sha256": "046480d77355cb3d5b4d125fd0a506895535808971237747efb9907bc2131e13",
      "request_payload_committed": true,
      "response_format": {
        "type": "json_object"
      },
      "response_repair_allowed": false,
      "strict_parser_unchanged": true
    },
    "locked_inputs": [
      {
        "bytes": 4926643,
        "path": "protocols/paper_upgrade_v2/medium_execution_plan_v2.jsonl",
        "sha256": "573625a9e1e56c9a8be68fe21368d3e90e268974aa7285bec926d4591f8ec254"
      },
      {
        "bytes": 2870,
        "path": "protocols/paper_upgrade_v2/medium_execution_manifest_v2.json",
        "sha256": "1aea6fafefbf1770e7e3477a8e2fedce32c93bd79f697d22885bceb595cc64b0"
      },
      {
        "bytes": 24083,
        "path": "protocols/paper_upgrade_v2/medium_execution_manifest_v3_preflight.json",
        "sha256": "e2dd2db7baa48d0bc636f4aa942451f48b08173ba1fee0aa9156c22b3b120c15"
      },
      {
        "bytes": 5407,
        "path": "protocols/paper_upgrade_v2/dual_provider_budget_policy_v1.json",
        "sha256": "b90e54c09b2ef9031f59afe678cdc300acf42c71ba9b4793a4e37025d8712253"
      },
      {
        "bytes": 2586,
        "path": "protocols/paper_upgrade_v2/provider_safety_policy_v1.json",
        "sha256": "e505a3b92f605320c315f3ecb7e4a02973040f9153b4b95b4601a9148dfd0894"
      },
      {
        "bytes": 1921,
        "path": "protocols/paper_upgrade_v2/provider_request_trace_activation_v2.json",
        "sha256": "ac15d82bc5631eb49c3e7b4344e143f753f17d40725845fa8a3507dc26de2b45"
      },
      {
        "bytes": 8147,
        "path": "protocols/paper_upgrade_v2/admissions/deepseek_pilot_admission_v2.json",
        "sha256": "3456e4c3957025017c3cfceab4530dda7e4076891129328f9e3e177cd30abe76"
      },
      {
        "bytes": 4252,
        "path": "outputs/paper_upgrade_v2/formal_pilot/deepseek/fd89c79707414a035a9d4309c3c3125bde14f7260c0e4c9cd66088164076fbe7/post_pilot_review_v1.json",
        "sha256": "95d4cf52cc71388d30c2cc75609f8e551b5a65d9fce99209228ac0121d2eb5a8"
      },
      {
        "bytes": 65346,
        "path": "experiments/paper_v2/formal_matrix_controller_v1.py",
        "sha256": "54447182e32ea81de4f7d3e1a9b44472931cdc5b0afae2793fbaed5ef3fcc1be"
      },
      {
        "bytes": 12310,
        "path": "schemas/paper_v2/formal_matrix_admission_v1.schema.json",
        "sha256": "9da7778dfb996b83ec3af4621f0e0795d70d2a0d0b01fa1e11b72b2fe90b6963"
      },
      {
        "bytes": 79361,
        "path": "experiments/paper_v2/live_condition_runtime.py",
        "sha256": "44b1eb05a87f23b46e3860a22dbdfc92b08b9aba26d9e055af85f97dc9af5f98"
      },
      {
        "bytes": 32576,
        "path": "experiments/paper_v2/formal_condition_executors.py",
        "sha256": "dcd39222d04c0081ed66b0bc51c37a4949f187dfc83b36ca42022b7acfc6aa93"
      },
      {
        "bytes": 26839,
        "path": "experiments/paper_v2/formal_record_store_v2.py",
        "sha256": "67075156efa12a7a447b160b8140b16002fd5bd4d24261cf37b2b21226d7b157"
      },
      {
        "bytes": 4859,
        "path": "experiments/paper_v2/contracts_v2.py",
        "sha256": "4349aef13c7a87c908ddfde2f4459e8916d88d51f1a9ae407840cd40a5a18db7"
      },
      {
        "bytes": 27450,
        "path": "experiments/paper_v2/provider_trace_bundle.py",
        "sha256": "c7dd83bf8ab4dad7628a54fd9f270dc41d0dc59a0118a688c4ed734c03f5e5f1"
      },
      {
        "bytes": 28380,
        "path": "experiments/paper_v2/provider_request_trace_candidate.py",
        "sha256": "9f7a7b024baab51d22725ad535460d2a24a52d0b50ccf3a93c231abb72653c8c"
      },
      {
        "bytes": 10520,
        "path": "experiments/paper_v2/provider_request_trace_activation.py",
        "sha256": "babf75b6c50a4725ff2e3c9abddc56ca556df317eb29ef0a4ccf7a7f1a6ef618"
      },
      {
        "bytes": 43604,
        "path": "experiments/paper_v2/official_provider_executor.py",
        "sha256": "3b33057adddacc68863d14e313d975ecd8d359c18b72585a774161793801aa54"
      },
      {
        "bytes": 23949,
        "path": "experiments/paper_v2/provider_budget.py",